{
  "schemaVersion": 1,
  "packId": "eng.MRK-8-31-9-1",
  "guideSha256": "0e378c0066e61653ca5525366467cb536da382b34ffd51ad85666c8cf5163f26",
  "steps": [
    {
      "id": "S01",
      "title": "Hear and Heart",
      "units": [
        {
          "id": "S01-U001",
          "textSha256": "c25ae498a31bb881b9ef88ecdc9bb3b8c04f8dd4291b0d5cbd6ecd38d1aafb55",
          "kind": "paragraph"
        },
        {
          "id": "S01-U002",
          "textSha256": "3758e52b8a813dae669e663c562e10771ab713166259372a14e10781d052da20",
          "kind": "paragraph"
        },
        {
          "id": "S01-U003",
          "textSha256": "c6ef6ed4d31b97cf4a0d03a8228505d052a8a780a5fe0413ebc441860df97b5d",
          "kind": "list-item"
        },
        {
          "id": "S01-U004",
          "textSha256": "e8a93c2c61fe1a0f6f81fa58997b305e6fc98309b710e3a31ff8334e8644a3eb",
          "kind": "list-item"
        },
        {
          "id": "S01-U005",
          "textSha256": "224a8cdb1dae5fd573717f4852d63eb204ee54884add43c491fba79b896ccb0a",
          "kind": "list-item"
        },
        {
          "id": "S01-U006",
          "textSha256": "5ec46dee57eb35404b2cea3f9aaa67f2973ac8781088fa05d8073f9e72fdf4c3",
          "kind": "list-item"
        },
        {
          "id": "S01-U007",
          "textSha256": "97dd8ff3c182bdac8fd7e57ffe1bf62350452bd66178db6560b7909eb5237842",
          "kind": "list-item"
        },
        {
          "id": "S01-U008",
          "textSha256": "d7a5f7f06349c901d886647055b1f48f7251a9fbfe2b37e509b26e0538704e46",
          "kind": "list-item"
        }
      ]
    },
    {
      "id": "S02",
      "title": "Setting the Stage",
      "units": [
        {
          "id": "S02-U001",
          "textSha256": "d486c2fd1a9b25bd6b76b65b8f20e751f806fe7783f188b4793ffa1670464580",
          "kind": "paragraph"
        },
        {
          "id": "S02-U002",
          "textSha256": "34dcb433e83bca64e8eb82df523fb51e1335b0afd3f4c75c4ec775ee319fde15",
          "kind": "paragraph"
        },
        {
          "id": "S02-U003",
          "textSha256": "57a369cd50fee92944700c45b1a86201a7ad3c0c91e872d5cef627815e0f8ced",
          "kind": "paragraph"
        },
        {
          "id": "S02-U004",
          "textSha256": "c2b35e613754f7471dfc4a32d6c733cd07248920fff010b23c113dbcd4918cd5",
          "kind": "paragraph"
        },
        {
          "id": "S02-U005",
          "textSha256": "72caadd6a4a74030d8ded82586fc80271863f573c04db9d06cfdc53122d426bc",
          "kind": "paragraph",
          "resources": [
            "term-eng-t130"
          ]
        },
        {
          "id": "S02-U006",
          "textSha256": "01de4b14f3c5aa274ffd2c56f21fec5d49b767a3f19ed5a1f3b814b24e19d961",
          "kind": "paragraph",
          "resources": [
            "term-eng-t130"
          ]
        },
        {
          "id": "S02-U007",
          "textSha256": "09ae825c90279718e815fa7ba9eee05ef300cae4cc65e97919f959620d14d255",
          "kind": "paragraph"
        },
        {
          "id": "S02-U008",
          "textSha256": "d1277ac03f0d93b204b294f1444abf5efacf2aeb96f8572b5ab805d857d67228",
          "kind": "paragraph"
        },
        {
          "id": "S02-U009",
          "textSha256": "04544669778583fa07e20e1e7f5449185d9e4a537a74f45838259cfcf6244bc9",
          "kind": "paragraph"
        },
        {
          "id": "S02-U010",
          "textSha256": "b97d115c216b9c070b9a15c57887b096e7715d109248ad9db101ac7a11153521",
          "kind": "paragraph"
        },
        {
          "id": "S02-U011",
          "textSha256": "fce8d577dcfb9a548a78f733cd275ec329818dbae6afb5f9fe2be901b7dbd769",
          "kind": "paragraph"
        },
        {
          "id": "S02-U012",
          "textSha256": "648cbedfda38057c96a35e21781893e5891db1e1ea4ce0404c440ec10a27d682",
          "kind": "paragraph",
          "resources": [
            "term-eng-t118"
          ]
        },
        {
          "id": "S02-U013",
          "textSha256": "3205bb2e64792ca0d0474b4bd2dae7c911a2c4b5113b735d5e3f3558f84ecf89",
          "kind": "paragraph"
        },
        {
          "id": "S02-U014",
          "textSha256": "41b30e90600fd6048f7ccdd10a572f20e8b0870d34933ff6d43b07d77466ee0c",
          "kind": "paragraph"
        },
        {
          "id": "S02-U015",
          "textSha256": "de113d3ca1cc3b5ed9bd6f2fa364b9581310c2f97447e0227d90f7a3b4373dc6",
          "kind": "paragraph"
        },
        {
          "id": "S02-U016",
          "textSha256": "b8930d201e56a5fe8ef0c5e3ad62c7e22c513499f411708270316bf74d47c40f",
          "kind": "paragraph",
          "resources": [
            "term-eng-t30"
          ]
        },
        {
          "id": "S02-U017",
          "textSha256": "3f137bd8a64f4c7500c7244540fcb550365be08f7a892493c23096dfba0f4858",
          "kind": "paragraph",
          "resources": [
            "term-eng-t30",
            "term-eng-t160"
          ]
        },
        {
          "id": "S02-U018",
          "textSha256": "12aecdde0efc3a4b7182c7f7681ea47569d4b11527a7ca0e32026529e76d6cf7",
          "kind": "paragraph"
        },
        {
          "id": "S02-U019",
          "textSha256": "dc8c8f265a02f6ddb81aa6cae86e181ba09b2f4942956e9acd8ff79a0ca16196",
          "kind": "paragraph"
        },
        {
          "id": "S02-U020",
          "textSha256": "04670b81cde1ba2cf4c070456ff70f92d33f55a4ea7c2fc36c9a60a6f0ed454b",
          "kind": "paragraph"
        },
        {
          "id": "S02-U021",
          "textSha256": "05b61bbd5afc67d13e0af5b455acce7e7bcc8967f68b15a61b7bbfe1aa315792",
          "kind": "paragraph"
        },
        {
          "id": "S02-U022",
          "textSha256": "a55503a1c76b52e86f0385de3ace879a06347f9c151d9969451f400ad66d174b",
          "kind": "paragraph",
          "resources": [
            "term-eng-t130",
            "term-eng-t131"
          ]
        },
        {
          "id": "S02-U023",
          "textSha256": "4edfc2656048ec9c0663899065bf06d153c01e3792bdaa84fb689381e716885a",
          "kind": "paragraph",
          "resources": [
            "term-eng-t58"
          ]
        },
        {
          "id": "S02-U024",
          "textSha256": "99d97bd5dd6dbefc472340b538c42f576d0cbca6eb76baf9ee35a94be71c8cd9",
          "kind": "paragraph",
          "resources": [
            "term-eng-t58"
          ]
        }
      ]
    },
    {
      "id": "S03",
      "title": "Defining the Scenes",
      "units": [
        {
          "id": "S03-U001",
          "textSha256": "37af3fb13318fa116ababe88c9e0bd3650bccf92b6bad3e9e5e659503bd4e694",
          "kind": "paragraph"
        },
        {
          "id": "S03-U002",
          "textSha256": "a61b9e3354ad33e5fa08433737e96e7439154607a4ec97a2a555911bb35f83e7",
          "kind": "paragraph"
        },
        {
          "id": "S03-U003",
          "textSha256": "3b4ffacb764ba14c8817150c4be6dcf11209ec715f9fce2d63c5814b4e41baa3",
          "kind": "paragraph"
        },
        {
          "id": "S03-U004",
          "textSha256": "778372f31865aa7c868c6f48f14cf83798f0535f433e30ff933ba1ad0a76c830",
          "kind": "paragraph",
          "resources": [
            "term-eng-t130"
          ]
        },
        {
          "id": "S03-U005",
          "textSha256": "810e0be75e0cac20bc39906a45aa3e9847a193448ee015c52e831cb791855b66",
          "kind": "paragraph",
          "resources": [
            "term-eng-t118"
          ]
        },
        {
          "id": "S03-U006",
          "textSha256": "e74ada371d0dde590d9985f0fc4b50e235c9e1896ed8109ae80827df1106d29e",
          "kind": "paragraph"
        },
        {
          "id": "S03-U007",
          "textSha256": "fbbf57c5c98a0646849fbb07a7c2a3e082e2843e68cdf2caf14c5ec01273f693",
          "kind": "paragraph"
        },
        {
          "id": "S03-U008",
          "textSha256": "62fe4843ff9d2d79c52749cb0073c8490e7e490f03b98911d3acd4661ea69b5b",
          "kind": "list-item"
        },
        {
          "id": "S03-U009",
          "textSha256": "b429209f174783e2d0257accb05b21727e35a935004f308b516d9fce53b4de3b",
          "kind": "list-item"
        },
        {
          "id": "S03-U010",
          "textSha256": "2ffb80271e2763a452dda3e81364658db1bbbbc81582ff729d1b20953dab893f",
          "kind": "list-item"
        },
        {
          "id": "S03-U011",
          "textSha256": "71350d553544e0522d9cb7ad3093a2aeb31a729bc471e7de3372e21f84f1b63e",
          "kind": "list-item",
          "resources": [
            "term-eng-t118"
          ]
        },
        {
          "id": "S03-U012",
          "textSha256": "15ca8341a49d56f7f8dd5555bd3b932036300f4d68a8b03dbb95f66e3a94eb0b",
          "kind": "list-item"
        },
        {
          "id": "S03-U013",
          "textSha256": "0890d7236cb6da0fcd82ef2de41c60efb379340d9a622bc1f5288432aa8a6beb",
          "kind": "list-item"
        },
        {
          "id": "S03-U014",
          "textSha256": "a2b695fcd697eadca57721c579cde768a5cc35f504938aab4a036cc216e274af",
          "kind": "list-item"
        },
        {
          "id": "S03-U015",
          "textSha256": "a908f9e33277ed8e48a81473a63156422261b854494e695602d4779b94a64824",
          "kind": "paragraph"
        },
        {
          "id": "S03-U016",
          "textSha256": "e974e0c072005e54e4b791df5dc70a5290daa89473d8fd03c1bfb26e4b32148c",
          "kind": "paragraph"
        },
        {
          "id": "S03-U017",
          "textSha256": "16fd12b9d0f8e7a6e765aaae34a68b7606c2f555528199f22265f17679fc0071",
          "kind": "paragraph"
        },
        {
          "id": "S03-U018",
          "textSha256": "beb35586c6f43604207fc4b8714c6d206d910d91608a34068cc7e80a6c7b5a2d",
          "kind": "paragraph",
          "resources": [
            "term-eng-t118"
          ]
        },
        {
          "id": "S03-U019",
          "textSha256": "223299dc5a482ea618d3326b765a4d85d7484e7708a79b246f80d14079b71e57",
          "kind": "paragraph"
        },
        {